"StartDate","EndDate","Status","IPAddress","Progress","Duration..in.seconds.","Finished","RecordedDate","ResponseId","RecipientLastName","RecipientFirstName","RecipientEmail","ExternalReference","LocationLatitude","LocationLongitude","DistributionChannel","UserLanguage","entered_mTurkID","CWVopen","questioneasy","thinkeasy","behaveopen","howact","whatwrite","CWV_1","CWV_6","CWV_10","CWV_5","harshlanguage","showdisgust","aggressivegestures","actintimidate","apologize","actnice","attencheck_1","readyupset","actcold","threats","blame","polite","showconcern","self_dominant","self_forceful","self_cold","self_warm","age","gender","race","education","comments","workerId","condition","CWV","bell_behav","warm_behav","self_bell","cat_selfbell","comprehension"
"2022-02-13 13:41:06","2022-02-13 13:46:36",0,"173.73.155.62",100,330,1,"2022-02-13 13:46:37","R_2zMScI9Rnuovdie","","","","",38.8865051269531,-77.0911026000977,"anonymous","EN","AE298K1SUDSPK","My friends and I were playing darts and really going hard to win. there was some trash talking but we stayed cordial despite the harsh words being exchanged. Also a few disagreements about the rules since non of us are well versed in them.",4,4,"we were playing darts and it was competitive to win the games",4,1,5,5,3,4,2,2,2,2,3,3,5,3,2,2,3,3,3,3,2,4,3,35,1,1,4,"","AE298K1SUDSPK",1,4.75,2.25,3,3,"high",1
"2022-02-13 13:30:05","2022-02-13 13:46:42",0,"197.237.172.69",100,996,1,"2022-02-13 13:46:42","R_2962l0GVC4qk5ld","","","","",-1.28410339355469,36.8155059814453,"anonymous","EN","A2QP3HJBFY8MB5","We had a departmental sports day. I was chosen to lead the team to a 4X4 relay competing with other departments. The trick for us to win was to put the best person to start the run. in between we had to slot in less fit members and finally crown it again with a physically fit member. as a group we agreed and guess what... we emerged as the overall winners.",4,4,"1. Agreed on a game plan- this shows co-operation among the team
",1,4,4,6,4,7,1,1,1,3,4,5,5,1,1,1,1,5,5,4,3,1,5,55,2,2,4,"","A2QP3HJBFY8MB5",0,3.75,1.25,4.75,2.25,"med",1
"2022-02-13 13:36:37","2022-02-13 13:46:49",0,"136.37.164.54",100,612,1,"2022-02-13 13:46:50","R_TwqGdkkGqEilWLL","","","","",38.9523010253906,-94.739501953125,"anonymous","EN","A3MELYYGRJ61SX","I work as a manager and I want everyone to work together as a team. I want a cooperative atmosphere at work.",5,5,"They have separate assignments but will help each other prepare reports.",2,4,2,2,6,7,1,1,1,1,4,5,5,1,1,1,1,5,5,1,1,1,5,59,2,1,4,"","A3MELYYGRJ61SX",0,1.75,1,4.75,1,"low",1
"2022-02-13 13:42:56","2022-02-13 13:47:06",0,"73.84.127.135",100,250,1,"2022-02-13 13:47:07","R_2VPV6bhyUmijFaF","","","","",26.9349975585938,-80.1177978515625,"anonymous","EN","A10PF5EUAE8M8P","At work we pick who we think will win each week's NFL games and it gets very competitive.  No teamwork to it, it's all about individual glory.",5,2,"We want to make the most correct picks so that we can have bragging rights over other co-workers.",4,1,3,4,5,6,3,2,2,2,4,4,5,3,1,2,3,4,4,2,2,2,4,38,1,1,4,"","A10PF5EUAE8M8P",1,3,2.25,4,2,"med",1
"2022-02-13 13:38:13","2022-02-13 13:47:20",0,"67.233.90.52",100,546,1,"2022-02-13 13:47:20","R_1jrHa41FfAkV5gU","","","","",29.1051940917969,-82.0954971313477,"anonymous","EN","A1L8FGWN4ZSK0X","Our neighbor got on the wrong side of several board members on our HOA and they wanted to kick him off the board. To do so, the remaining board members initiated a campaign and spread rumors that my neighbor and myself were receiving special kickbacks in the form of ""special attention"" from the landscapers who serve the community. This was fabricated but served their purpose of creating an legal reason for kicking him off. They drug our reputations through the mud, just to get him off the board.",5,5,"Because our neighbor was a threat to their power, they lied in order to get their way and maintain their control.",5,1,5,5,4,7,1,1,1,2,4,4,5,1,1,1,2,5,5,1,2,1,5,60,2,1,4,"","A1L8FGWN4ZSK0X",1,3.75,1.25,4.5,1.25,"med",1
"2022-02-13 13:34:36","2022-02-13 13:47:34",0,"89.46.114.207",100,777,1,"2022-02-13 13:47:34","R_2AT3Opv7kZpRD68","","","","",34.0484924316406,-118.252899169922,"anonymous","EN","A1FHC4Z6QXDQSS","I haven't really been in any, I guess closest to this would be last summer around 6 months ago. They had an assistant manager position come up at work and 3 different co-workers wanted the position and remember a couple wanted it really bad and maybe felt a little competitive, they would kind of bad mouthed each other to me when I worked with them alone and felt like they should get it and the other person wasn't good enough,  but they end up hiring someone outside of the hotel for the position ",5,5,"they just would talk poorly about the other people who wanted the job and would talk about how much they wanted and should of the position how they deserved it the most",4,1,2,3,4,7,1,2,1,1,4,5,5,1,2,1,2,5,5,2,1,1,4,39,1,1,3,"","A1FHC4Z6QXDQSS",1,2.5,1.375,4.75,1.5,"med",1
"2022-02-13 13:42:48","2022-02-13 13:47:50",0,"99.106.116.30",100,301,1,"2022-02-13 13:47:50","R_30dwgaXru6SmtjA","","","","",29.7373046875,-95.3972015380859,"anonymous","EN","A1Z748HOKCNJ8X","the only thing I can think of is playing words with friends - they have a one on one game with strangers where you try to get to 150 points first. There is no manipulation or sabotage, just trying to win",5,2,"played a game on words with friends, the game resets every few days and there is a leaderboard so you can see where you are in relation to others",5,1,2,3,5,6,2,2,2,2,4,4,5,2,2,2,2,4,4,2,2,3,3,60,2,1,2,"","A1Z748HOKCNJ8X",1,2.5,2,4,2.5,"med",1
"2022-02-13 13:38:27","2022-02-13 13:48:29",0,"65.96.216.227",100,601,1,"2022-02-13 13:48:29","R_2BnUfYHdjEJev9P","","","","",42.2012939453125,-70.7543029785156,"anonymous","EN","ANNK11Y08X9LY","I was working on a work project last summer with a group of cross-functional team members, and we were trying to meet a big deadline.  There was one person who wasn't carrying their weight in the project, and a coworker and I were trying to finish up the work of the other person who wasn't doing their job.  My coworker and I worked very hard to make the deadline, both working very late nights.  My coworker, who I enjoy working with, was literally pulling all-nighters to get the work done, which I didn't as my sleep was too important to me.  They completed their part of the work before I did, making me feel pressured that I was supposed to also stay up all night to get the work done.",5,4,"Working to the point of staying up all night or only getting 1 hour of sleep for a several nights to get their part of the project done.",4,1,5,5,2,6,2,1,1,3,4,5,5,3,2,3,3,5,4,2,2,1,5,55,2,1,5,"thank you!","ANNK11Y08X9LY",1,4.5,2.25,4.5,1.5,"med",1
"2022-02-13 13:45:26","2022-02-13 13:48:35",0,"73.41.212.11",100,188,1,"2022-02-13 13:48:35","R_2aLCUB2HqMB4Shl","","","","",38.7608947753906,-121.286697387695,"anonymous","EN","A255TQAF514QL6","We were in a competition for fantasy football. People would unfairly take player so that other teams could not take them. Unfair trades were made between teams so they could split the pot if they won the league.",5,5,"People would unfairly grab players and release them causing a pause on when they could get picked up. This way, if a team needed a player, they could not pick up the released player until after sunday football games.",5,1,5,5,3,3,3,3,3,3,3,3,5,3,3,3,3,3,3,2,2,2,4,30,1,4,4,"","A255TQAF514QL6",1,5,3,3,2,"med",1
"2022-02-13 13:29:58","2022-02-13 13:48:57",0,"47.201.197.123",100,1139,1,"2022-02-13 13:48:58","R_3P5ZjjCUCfgHFS1","","","","",27.9470062255859,-82.7942962646484,"anonymous","EN","A20PIEBHXCNSRP","I felt cooperative working at the job trying to set up a transfer we had to do. It required all of our department to do, but we were successful in getting it done. It brought us together and I enjoyed the process.",5,5,"They assisted and did their part to get the process pushed through.",1,4,4,4,4,5,1,2,1,1,5,5,5,1,1,1,2,5,5,1,1,1,5,30,1,1,5,"","A20PIEBHXCNSRP",0,3.75,1.25,5,1,"low",1
"2022-02-13 13:38:13","2022-02-13 13:49:16",0,"71.68.182.77",100,662,1,"2022-02-13 13:49:16","R_1EafTw9cVfO0ZQ6","","","","",35.2841949462891,-80.8719024658203,"anonymous","EN","A3724Y7XIYIQ5Z","A cooperative situation that I was in was restocking the store. Everyone worked to gather to get the job don't as quickly and efficiently as possible. ",4,4,"working together for the good of the store",1,4,5,5,5,7,1,1,2,1,5,5,5,1,1,2,1,5,4,3,2,1,4,23,2,2,3,"","A3724Y7XIYIQ5Z",0,3.5,1.25,4.75,2,"med",1
"2022-02-13 13:43:04","2022-02-13 13:49:21",0,"98.29.29.16",100,377,1,"2022-02-13 13:49:21","R_QiVFMSnlUl1vGMN","","","","",39.643798828125,-84.1743011474609,"anonymous","EN","A39YZG9BJIUC94","I was running my first race and it was a very popular run.  There were several hundred people running in the same group.",5,5,"everyone was trying to run and achieve their personal best for this race.",5,1,1,3,4,7,1,1,2,1,4,5,5,1,1,1,1,5,5,1,3,1,4,51,2,1,4,"","A39YZG9BJIUC94",1,2.25,1.125,4.75,1.75,"med",1
"2022-02-13 13:41:00","2022-02-13 13:49:50",0,"69.246.131.180",100,530,1,"2022-02-13 13:49:51","R_3nB0AfjZpHydfTG","","","","",30.2108001708984,-84.3205032348633,"anonymous","EN","AQPKTA8UCSJ5Q","I participated in planning a holiday dinner. The event was cooperative because everyone decided what to bring and worked with a flexible mindset. The dinner was held outside to address the COVID-19 concerns. Everyone had a good time and no one got sick from the food or the virus afterwards. ",5,5,"Everyone worked together to do what they could manage doing that did not violate their boundaries financially or concerns regarding holding the event during COVID-19. ",1,4,2,2,2,7,2,2,1,1,3,5,5,2,2,2,2,5,5,2,1,1,5,51,2,2,5,"Kindness usually is the best behavior to demonstrate towards others. It invites people to want to work with you.","AQPKTA8UCSJ5Q",0,2.75,1.75,4.5,1.25,"med",1
"2022-02-13 13:41:02","2022-02-13 13:50:03",0,"74.110.181.56",100,541,1,"2022-02-13 13:50:03","R_QbqnVTESwuK0J2x","","","","",37.4611968994141,-77.3949966430664,"anonymous","EN","A21QH0Q69SZR3R","The only truly competitive situations of this nature that I have personally been involved in during the past 12 months are while playing video games. In particular ""Rocket League"". During the game it is 3 v 3, and when you have a teammate that is lower quality that you did not trust to carry out their duty, the dynamic becomes ""toxic"", the team starts sending nasty comments to each other, and we play individually. It can devolve to a point where you sabotage your own teammate and let the other team win so that your teammate loses. It is a cycle of one player making a mistake, the other teammates insulting them (anonymously online), sabotaging that teammate, the other team scores more points, and the cycle continues.",5,1,"If one teammate had the ball the others would steal it off of them. They would send (anonymously) nasty messages to the teammate. They would also purposely help the other team just to keep their teammate from winning.",5,1,4,5,6,7,3,2,1,2,5,5,5,2,1,1,2,5,4,2,2,1,4,27,1,1,4,"How much competition you experience is mainly dependent on your work atmosphere. Especially since Covid has limited some outside social interactions. So if your workplace is generally cordial, it can be pretty tough to think of a situation.","A21QH0Q69SZR3R",1,3,1.75,4.75,1.75,"med",0
"2022-02-13 13:37:55","2022-02-13 13:50:33",0,"75.133.158.250",100,757,1,"2022-02-13 13:50:33","R_spdIJluB9GL1VWp","","","","",38.7456970214844,-90.2099990844727,"anonymous","EN","A136TLVBJV40HC","I was recently involved in helping community church move out of the building that they had church services in. They were forced to move out of the building because of the pandemic. We all worked in tandem got the job done swiftly and efficiently and got the goal accomplished.",5,5,"We had big items that we had to lift and move together and was done with cooperative work.",1,4,3,5,5,7,1,1,1,1,5,5,5,1,1,1,1,5,5,2,1,1,5,51,1,2,3,"","A136TLVBJV40HC",0,3,1,5,1.25,"med",1
"2022-02-13 13:42:54","2022-02-13 13:50:33",0,"72.181.5.162",100,459,1,"2022-02-13 13:50:34","R_2rVhJnZBLdOi6lf","","","","",32.9259948730469,-96.9665985107422,"anonymous","EN","A274N9003EN2M6","Last Thanksgiving, people on my street my neighbors all decided to have a block party as most of us were still not comfortable traveling, socializing in indoor spaces etc. due to the pandemic. It was so heart warming how all of us went above and beyond the expectations in planning and executing this event. It ended up being half a day full of activities for kids, games for adults followed by giveaways and catered dinner. It was done in the communal space near our homes and it was the most enjoyable experience in my recent memory. It was totally made possible by everyone being generous with their skills, their time and their pockets. I was in charge of the kids games and prizes.",5,5,"People all came together to pitch in whatever was needed to make the vent a success. Like we were short on tables so 2 families lent their own, same with chairs. I donated 2 huge bags of chocolate truffles and party favors to pass out to the kids. ",1,4,5,3,6,6,2,1,2,2,2,4,5,2,2,4,2,4,4,3,2,1,4,41,1,5,6,"","A274N9003EN2M6",0,3,2.125,3.5,2,"med",1
"2022-02-13 13:42:10","2022-02-13 13:50:39",0,"75.128.29.107",100,508,1,"2022-02-13 13:50:39","R_2S7Uv4X35aYcKIc","","","","",37.5854949951172,-120.945297241211,"anonymous","EN","AGTVCSOSCM867","Every day my job involves cooperation with other people to be successful.  I must work with my employees on a common goal to complete the daily tasks and depends on cooperation from other entities to be successful.",4,2,"Again the first part of our task involves an outside entity first doing their job and providing us what we need in our department in order to do our job of offloading trailers and making them available for reuse. ",2,4,6,5,5,6,2,2,1,2,2,4,5,2,1,1,3,5,3,2,2,4,4,55,1,1,4,"","AGTVCSOSCM867",0,4,1.75,3.5,2.5,"med",1
"2022-02-13 13:43:14","2022-02-13 13:50:48",0,"76.190.18.162",100,453,1,"2022-02-13 13:50:48","R_2wmouAtGZef84yi","","","","",41.5052947998047,-81.5566024780273,"anonymous","EN","A1VWBIIM9VTHML","When I was moving out of my main home and into my new studio, my friend K. and her family were very helpful. She/they provided both physical moving assistance and a separate place (their home) to decompress. In return I watched her kids and brought over dinners. It was a nice memory from an otherwise stressful time.",5,4,"We all joined together in helping each other out. We all just sort of jumped in without having to be asked what to do.",1,4,5,5,4,5,2,3,2,2,5,5,5,2,2,3,2,5,4,3,3,2,4,47,2,1,3,"I'm back in college, now","A1VWBIIM9VTHML",0,4.25,2.25,4.75,2.5,"med",1
"2022-02-13 13:44:59","2022-02-13 13:51:18",0,"98.146.194.160",100,379,1,"2022-02-13 13:51:19","R_21btZroDcBdQUFQ","","","","",46.7313995361328,-117.173301696777,"anonymous","EN","A2YUYXAI4SAOLY","Family members gathered at my late mother-in-law's apartment to distribute her belongings and clean out unwanted materials for trash/donation. There were no disputes over any item and the work proceeded efficiently and fairly.",5,5,"People assisted each other in loading large items into vehicles and took turns opening the door and making trips to the trash bin.",1,4,4,3,6,5,3,2,1,2,5,5,5,2,2,1,2,5,3,2,2,3,3,67,2,1,6,"","A2YUYXAI4SAOLY",0,3,1.875,4.5,2.5,"med",1
"2022-02-13 13:46:50","2022-02-13 13:51:19",0,"174.100.54.180",100,269,1,"2022-02-13 13:51:19","R_12bYkD9kke93adJ","","","","",41.3721923828125,-82.1087036132812,"anonymous","EN","A260EJW55KFZX7","I would have to say when all my friends pitched in to help another friend who had financial problems.  We all chipped in 40 each and gave her 320 dollars to help pay to get her furnace fixed.",5,4,"We all helped our friend pay to get her furnace fixed and told her to pay us back whenever she can.",1,4,2,3,6,7,1,1,1,2,5,5,5,1,2,1,2,5,4,2,1,1,4,67,2,1,3,"","A260EJW55KFZX7",0,2,1.375,4.75,1.5,"med",1
"2022-02-13 13:42:47","2022-02-13 13:51:20",0,"174.202.231.23",100,513,1,"2022-02-13 13:51:20","R_22JjaeskVBkTKIu","","","","",29.7953033447266,-95.4968032836914,"anonymous","EN","A4JC2PG5DWUHI","Working on a project at work to release a new application. All members of the team contributed their skills and attention and those who were not technical supported by testing. It is a great success.
",5,5,"People offered to help in any way they can. Others took suggestions and went above and beyond to make changes when needed.",1,4,4,4,6,6,2,1,1,2,4,4,5,2,2,2,3,5,4,4,3,2,4,47,1,3,4,"thanks!","A4JC2PG5DWUHI",0,3,1.875,4.25,2.75,"high",1
"2022-02-13 13:36:40","2022-02-13 13:51:57",0,"174.100.31.51",100,917,1,"2022-02-13 13:51:58","R_1ikgubpRiJHkAwF","","","","",41.3890075683594,-81.5257034301758,"anonymous","EN","A3KLHS8HGYLM93","I play online multi-player games and they are very competitive.  Everyone plays against each other to win.  There is no generosity, and the point is to rather selfishly win.",5,1,"They would use skills to advance in the game, and possibly manipulative moves to accomplish a win.",5,1,3,3,5,7,2,2,2,1,4,5,5,2,1,2,2,5,5,2,2,1,5,43,2,1,2,"","A3KLHS8HGYLM93",1,2.5,1.75,4.75,1.5,"med",0
"2022-02-13 13:49:54","2022-02-13 13:52:32",0,"173.48.107.15",100,158,1,"2022-02-13 13:52:33","R_Rh36WgLDM7QGSBj","","","","",42.5944976806641,-71.3571014404297,"anonymous","EN","A3F08RS1DXP8PN","I was recently involved in pitching an idea a client. It was about direction of doing a platform transformation. I was up against 3 other people. Winning the project meant a contract for 10 years and a hefty bump in my salary.",5,4,"Everyone was trying to get an advantage over the others and to figure out what they were planning to pitch.",5,1,4,4,6,7,1,1,1,1,3,5,5,1,1,1,1,5,5,1,1,1,5,32,2,1,4,"","A3F08RS1DXP8PN",1,2.75,1,4.5,1,"low",1
"2022-02-13 13:50:14","2022-02-13 13:52:33",0,"73.61.12.231",100,139,1,"2022-02-13 13:52:33","R_1PZQZUY28Ghzu2b","","","","",42.3426971435547,-71.0922012329102,"anonymous","EN","A2A56XB6YTRFJ9","i was working on a pitch deck with my team at work. we all had seperate sections and had to rely on each other to do their sections well.",5,4,"we worked together in a coopoerative and timely manner",1,4,1,1,7,7,1,1,1,1,4,5,5,1,1,1,1,5,5,1,1,1,5,25,2,1,4,"","A2A56XB6YTRFJ9",0,1,1,4.75,1,"low",1
"2022-02-13 13:42:42","2022-02-13 13:52:55",0,"172.58.3.179",100,613,1,"2022-02-13 13:52:56","R_1jQ84yV6ZXYXjY2","","","","",33.7042999267578,-84.3741989135742,"anonymous","EN","AK73OSE51YFDF","Through personal misfortunes, I had to stay in a homeless shelter for a few months. While there all of the clients worked together to prepare meals, clean the facility, do laundry, etc. on a daily basis. It gave us a sense of purpose and usefulness in a dark time in our life. Everyone help each other and there was no such thing as selfishness. ",5,5,"The things that people did was a united effort to help one another do the necessary things to maintain a daily routine of cleaning, cooking, laundry, etc.",1,4,3,5,5,6,1,1,1,1,5,5,5,1,1,1,1,5,5,2,4,1,5,52,1,2,4,"","AK73OSE51YFDF",0,3.25,1,5,2,"med",1
"2022-02-13 13:44:47","2022-02-13 13:53:07",0,"73.112.76.221",100,499,1,"2022-02-13 13:53:07","R_3QESrnB4xeBiDck","","","","",40.7718048095703,-74.2098007202148,"anonymous","EN","A5A14MTB35J23","I was at a conference in Miami for work.  There were other colleagues of mine at the same conference and we were all trying to get meetings with potential clients.  Because our compensation is tied to sales, getting intros and meetings with prospects at conferences is critical.   Did not coordinate with my workmates, and ensured that I was first in line for the morning breakfasts with clients and last to bed after group happy hours.  There was one night when I took elevator up to my room with my colleague after a few drinks when we both agreed to retire for the night, only to come back down after pretending to go back to my room.",5,4,"People, including me, deceived each other about conference activities they were attending and about times they would be at certain events.",5,1,6,6,3,3,3,3,2,3,3,3,5,3,3,2,3,4,3,4,4,4,3,53,1,1,4,"","A5A14MTB35J23",1,5.5,2.75,3.25,3.75,"high",1
"2022-02-13 13:46:44","2022-02-13 13:53:24",0,"47.35.202.192",100,399,1,"2022-02-13 13:53:24","R_pT1TJ8rGiTG260F","","","","",35.00439453125,-82.4309997558594,"anonymous","EN","A3PQPWN30ODXRE","Trying to get a parking space where none were available. Every time a place opened up, someone would jump in front & take it. I was late and the situation made me anxious knowing people were so aggressive. ",4,2,"Not waiting in line and jumping a head to take over a space. They were aggressive & not polite. ",5,1,4,4,5,6,3,3,3,3,4,4,5,3,3,3,3,4,4,2,2,2,3,54,2,1,4,"","A3PQPWN30ODXRE",1,3.25,3,4,2.25,"med",1
"2022-02-13 13:38:48","2022-02-13 13:54:31",0,"216.165.95.164",100,942,1,"2022-02-13 13:54:31","R_2fGNie7aTG5IwH2","","","","",40.7359008789062,-73.9904022216797,"anonymous","EN","A14LXHJAWRQWR6","I was in a competitive situation when I was in a 5k race and we were obviously competing against each other since we all wanted to win first place. It was pretty much every man for himself and nobody really helped anybody else get ahead",5,2,"They each focused on running their own race and did not give special help or extra favors to other competitors ",4,1,5,3,4,6,1,1,1,2,5,5,5,1,1,1,1,5,5,1,1,2,5,20,2,4,3,"","A14LXHJAWRQWR6",1,3.5,1.125,5,1.25,"med",1
"2022-02-13 13:49:07","2022-02-13 13:54:39",0,"108.39.210.188",100,331,1,"2022-02-13 13:54:39","R_1jDQBujqjQ7qnnP","","","","",40.4562072753906,-79.8162994384766,"anonymous","EN","A41APS6V2Z1FJ","It was at the boarding barn we were at before. This girl was always saying how much she knew about everything. For example, she was saying how she competed in this or that. Just because I was an adult and keep to myself and my horse, she thought that I knew nothing about horses. I've worked with them a lot. This made me upset, but I tried to just focus on my horse and show them that I actually DID know what I was doing.",3,3,"They would brag about all the things they knew and were acting condescending to other people. One reason being if you didn't have as nice things for your horse.",4,1,4,4,2,4,3,3,2,2,4,3,5,1,1,1,1,5,5,5,4,3,2,50,2,1,4,"","A41APS6V2Z1FJ",1,4.5,1.75,4.25,4,"high",1
"2022-02-13 13:47:58","2022-02-13 13:54:45",0,"23.120.88.236",100,406,1,"2022-02-13 13:54:45","R_BQdnccCIABOZDhv","","","","",33.7328948974609,-118.295104980469,"anonymous","EN","A2PB6QWU30GQRP","I was part of a big event at work. The day of the event, there were several issues and we were severely understaffed. But with the help of everyone present we were able to successfully pull off the event with the guests not catching on to what a cluster it was behind the scenes. ",5,2,"Everyone pulled there own weight and then some. It was crazy. ",1,4,5,5,3,5,2,1,1,1,4,4,5,3,2,2,1,5,5,2,1,1,3,31,2,1,5,"","A2PB6QWU30GQRP",0,4.5,1.625,4.5,1.75,"med",1
"2022-02-13 13:45:03","2022-02-13 13:54:48",0,"107.161.231.243",100,585,1,"2022-02-13 13:54:48","R_2P1ZeSEFzQCEKu4","","","","",39.4559936523438,-82.2298965454102,"anonymous","EN","A389KAGDNVULOJ","I was in the hosiptal visiting a loved one who was ill and everyone from the receptionist to the nurses, doctors and all the support team were so help and they worked so well as a team, helping each other with notes and taking turns explaining to me what happened. They were thoughtful and thourough with their explanations and I was patient with the long medical jargon.",4,2,"they were patient and kind. They were compassionate and thought out an answer for every question I had. ",1,4,2,2,5,7,1,1,1,1,3,5,5,1,1,1,1,5,5,1,1,1,5,32,2,1,4,"","A389KAGDNVULOJ",0,2,1,4.5,1,"low",1
"2022-02-13 13:53:49","2022-02-13 13:55:53",0,"75.69.196.70",100,123,1,"2022-02-13 13:55:53","R_PHiFrTNqqL4Ns6R","","","","",41.8878936767578,-70.8887023925781,"anonymous","EN","A3CHVBVD3VIA7Y","Competing nationally in cross country. Tough race, tough conditions and competitors. ",5,5,"Racing each other and other clubs.",5,1,4,4,3,4,3,3,3,3,3,3,5,3,3,3,3,3,3,2,2,2,4,37,1,1,4,"","A3CHVBVD3VIA7Y",1,4.25,3,3,2,"med",1
"2022-02-13 13:50:01","2022-02-13 13:55:55",0,"75.139.85.187",100,353,1,"2022-02-13 13:55:55","R_1reHn4fS1RgEat0","","","","",34.985595703125,-81.8246002197266,"anonymous","EN","A6W0BC36U0TUS","This situation occurred within my own family dynamics. My three daughters and their mums are always competing with each other and me for my attention. Instead of working as a team which we should as a family, it seems we are only out for our so called self-interest.",5,4,"Taking deliberate actions to impede communication and resolutions to problems.",4,1,2,2,4,6,2,2,1,1,5,3,5,2,2,1,3,5,4,1,1,2,2,35,3,1,3,"","A6W0BC36U0TUS",1,2.5,1.75,4.25,2,"med",1
"2022-02-13 13:38:26","2022-02-13 13:56:32",0,"184.17.130.226",100,1086,1,"2022-02-13 13:56:32","R_3I64TBsvQddnhEK","","","","",39.6421051025391,-85.1438980102539,"anonymous","EN","A3UT4PVIWBLFLN","I went on an away team and the people there were all cooperative and we helped launch a new building. ",5,5,"They asked questions and listen to our ideas.",1,4,3,3,5,5,1,1,1,2,4,4,5,2,1,1,1,4,5,4,2,1,4,27,2,3,4,"","A3UT4PVIWBLFLN",0,3,1.25,4.25,2.25,"med",1
