"StartDate","EndDate","Status","IPAddress","Progress","Duration..in.seconds.","Finished","RecordedDate","ResponseId","RecipientLastName","RecipientFirstName","RecipientEmail","ExternalReference","LocationLatitude","LocationLongitude","DistributionChannel","UserLanguage","entered_mTurkID","CWVopen","questioneasy","thinkeasy","behaveopen","howact","whatwrite","CWV_1","CWV_6","CWV_10","CWV_5","harshlanguage","showdisgust","aggressivegestures","actintimidate","apologize","actnice","attencheck_1","readyupset","actcold","threats","blame","polite","showconcern","self_dominant","self_forceful","self_cold","self_warm","age","gender","race","education","comments","workerId","condition","CWV","bell_behav","warm_behav","self_bell","cat_selfbell","comprehension"
"2022-02-13 13:50:22","2022-02-13 13:57:06",0,"172.223.122.2",100,403,1,"2022-02-13 13:57:06","R_1dibsODLq6e7CpF","","","","",32.5195007324219,-96.8105010986328,"anonymous","EN","A1UZ91EFSJFUM8","I had to see a surgeon for my GERD and a bad hernia. I listened to him talk about the positives and negatives and I decided with him that surgery would be the best thing for me. It's very hard to be cooperative with basically strangers who want to do surgery on you but I was glad I did it.",5,5,"He explained to me what was going to happen if I went through with surgery and with some reluctance at first, I finally agreed.",1,4,4,5,1,6,1,1,1,1,5,5,5,1,1,1,1,5,5,1,1,1,5,44,2,1,2,"","A1UZ91EFSJFUM8",0,4.5,1,5,1,"low",1
"2022-02-13 13:52:21","2022-02-13 13:57:31",0,"174.55.108.196",100,309,1,"2022-02-13 13:57:31","R_3qIktTlAnMgN6Op","","","","",39.9071960449219,-77.6360015869141,"anonymous","EN","A2CYT1T5918U1V","I was involved in a work project where different teams were competing to develop an innovative product. The project took six weeks to complete and brought out selfishness and uneasy feeling among coworkers. Our team lost the competition and the competition caused animosity between teams. ",5,5,"Different teams at work competed on developing an innovative product. It was cutthroat and teams failed to communicate with each other during the competition which lasted six weeks. ",5,1,5,3,6,7,3,3,3,3,3,4,5,2,2,2,2,4,4,2,2,1,5,57,1,1,6,"","A2CYT1T5918U1V",1,2.75,2.5,3.75,1.5,"med",1
"2022-02-13 13:51:45","2022-02-13 13:58:03",0,"107.77.225.72",100,377,1,"2022-02-13 13:58:03","R_3fN2e4CNqlhvvto","","","","",40.6712951660156,-73.8943023681641,"anonymous","EN","A22DL4DE4DYB0","For work we had a trivia night at a bar and we were all in teams. The prize was $500 split between 4 people so everyone became very competitive. Some people tried to cheat on their phones.",5,5,"People ended up trying to cheat at the trivia because there was such a big money prize available.",5,1,1,3,6,7,2,2,2,2,5,5,5,1,1,1,1,5,5,1,1,1,3,30,1,1,4,"","A22DL4DE4DYB0",1,1.75,1.5,5,1.5,"med",1
"2022-02-13 13:44:57","2022-02-13 13:58:21",0,"208.92.185.139",100,804,1,"2022-02-13 13:58:21","R_2VeU47ODr6EAnpa","","","","",37.0487060546875,-112.517402648926,"anonymous","EN","A1S0N5BIXAQO8I","Recently there was a shortage of toilet paper at the local Costco, it seems a rumor had caused a sort of mass hysteria about future needs. The place was crowded and lines of carts were surround an area where the last pallet of product was pulled off the shelves. There's more to the story but the result was I ended up with one of the prized bundles.",4,2,"Most people were trying to grab two packages to deny others from obtaining any, despite hand written signs limiting customers to only one each. Others waited patiently in line watching the pile begin to disappear. I discarded my cart and walked around the line of carts blocking the aisle and seized my prize.",4,1,2,2,6,6,1,1,1,1,3,5,5,1,1,1,3,5,4,2,1,1,5,55,1,1,3,"","A1S0N5BIXAQO8I",1,2,1.25,4.25,1.25,"med",1
"2022-02-13 13:39:57","2022-02-13 13:58:34",0,"73.10.105.232",100,1116,1,"2022-02-13 13:58:34","R_10DzEvtz485M7Bb","","","","",40.8125,-74.2134017944336,"anonymous","EN","A1RATFICCKLCQ","This was a project competition at work where the best project would be recognized company-wide and would receive a bonus. My co-workers and I were all eager to participate. I wanted to show off my skills and be monetary compensated if I won. It was fun and exciting at first but later devolved into a more unkind type of interaction where the top competitors were trying to undermine and sabotage one another. This did not feel good nor did it make our team any stronger. I felt it might not be good for moral but my supervisor though it was all in good fun. It ended with the winner thanking his competition for motivating her to do more.",4,4,"They were trying to best each other in a project competition which show cased their skills and talents. They also tried to undermine and provoke each other to make it harder to focus on their project ",5,1,4,4,5,6,3,2,2,3,3,3,5,2,3,2,3,3,3,3,3,2,4,35,2,3,4,"","A1RATFICCKLCQ",1,3.25,2.5,3,2.5,"med",1
"2022-02-13 13:54:21","2022-02-13 13:59:44",0,"174.202.43.7",100,322,1,"2022-02-13 13:59:45","R_27UoNPS06u0sblh","","","","",39.7536010742188,-86.1934967041016,"anonymous","EN","A11FHRIUGW7NFB","I had a family gathering last month. My father is very ill and people who have not been together in a long time were cooking, cleaning, and visiting together. It was inspiring.",5,5,"Not all of my family members get along but everyone made an effort to keep spirits up, especially my father's, while we were together.",1,4,3,4,5,6,1,1,1,2,5,4,5,1,2,3,2,4,4,1,1,1,5,43,2,1,4,"","A11FHRIUGW7NFB",0,3,1.625,4.25,1,"low",1
"2022-02-13 13:55:45","2022-02-13 13:59:49",0,"23.120.78.114",100,244,1,"2022-02-13 13:59:49","R_3HXKwmR0LCgS2Mq","","","","",31.8681030273438,-90.4029006958008,"anonymous","EN","A3MUW3RCHP2BBJ","I think home sales during the pandemic were like this.  It caused people to bid more on a house than their original budget allowed.  many waived home inspections, which could lead to costly repairs in the future. ",5,5,"They would out bid each other and waive standard tests (home inspections, termite etc) in order to buy a home.",5,1,5,5,4,5,1,1,1,1,4,4,5,1,1,1,1,5,4,1,1,1,4,40,4,1,4,"","A3MUW3RCHP2BBJ",1,4.25,1,4.25,1.25,"med",1
"2022-02-13 13:53:55","2022-02-13 13:59:56",0,"75.186.81.33",100,360,1,"2022-02-13 13:59:56","R_1LZNIRbmWgw47hc","","","","",40.2861022949219,-84.1728973388672,"anonymous","EN","A1WL9MIOGR6556","I was at work function and we were playing a competitive team game, where our team was working to solve riddles and puzzles before the other team in order to win a gift card prize. Our team leader became very competitive and it was very high-stress to perform and figure it out before the other teams. ",5,3,"Our team leader was talking down and other teams, calling them names and telling them we would win. He tried to overhear other team's answers to gain an advantage.",5,1,4,5,7,7,1,1,1,1,3,4,5,1,1,1,1,4,4,1,1,1,4,32,2,1,4,"","A1WL9MIOGR6556",1,2.75,1,3.75,1.25,"med",1
"2022-02-13 13:51:37","2022-02-13 14:00:02",0,"172.58.171.7",100,505,1,"2022-02-13 14:00:03","R_6rmRrlDZnzIdqZb","","","","",28.5435943603516,-81.3738021850586,"anonymous","EN","A20PE86B4RBAZC","Several of us worked together to organize and work a fundraising even for highschool football. Everyone that said they would be there showed up and did their part. Volunteers thanked the other volunteers for their contributions and it was very successful.",5,4,"Everyone worked together, coordinated their schedule and did their part.",1,4,4,4,5,6,2,2,2,1,3,5,5,1,2,1,2,5,4,1,1,1,5,50,2,1,4,"","A20PE86B4RBAZC",0,3.25,1.625,4.25,1,"low",1
"2022-02-13 13:54:16","2022-02-13 14:00:03",0,"24.1.239.227",100,346,1,"2022-02-13 14:00:03","R_1DA3qc22VtJC3Hq","","","","",41.50390625,-88.215202331543,"anonymous","EN","AYSRYVG3Z8IS4","Track meet.",5,2,"Racing.",5,1,4,5,4,4,2,2,1,1,4,4,5,3,2,2,2,5,4,2,2,2,4,54,2,1,4,"","AYSRYVG3Z8IS4",1,4.25,1.875,4.25,2,"med",1
"2022-02-13 13:55:47","2022-02-13 14:00:07",0,"173.233.6.131",100,259,1,"2022-02-13 14:00:07","R_3hGwqMVyrcMKYaf","","","","",40.6217041015625,-79.9430999755859,"anonymous","EN","A14VY6QXKBLC0D","My project team was given a tight, difficult deliverable. We came together well, each contributing above and beyond, to deliver results under pressure. The team was unselfish and trusted one another.",5,4,"People were unselfish with their time. They were willing to pitch in and go beyond their standard responsibilities.",1,4,2,2,6,6,2,1,1,1,4,5,5,1,2,1,1,5,5,1,1,2,4,37,1,1,5,"","A14VY6QXKBLC0D",0,2,1.25,4.75,1.5,"med",1
"2022-02-13 13:55:48","2022-02-13 14:00:09",0,"174.209.33.238",100,260,1,"2022-02-13 14:00:09","R_2t5mFMGPrmQViTJ","","","","",41.6983947753906,-87.7031021118164,"anonymous","EN","A17ZRK7P5TFAKK","The most competetive situation I can remember from recent times was when I was playing a game of Overwatch online with my friends.  The teams were both evenly matched in terms of skill, and the game was extremely heated and difficult.  My team was very uptight and weren't very nice to each other throughout the match.",5,5,"The people on my team tried to stay together to help each other stay alive during the fight.  The healers were on point and they had a rough time keeping up with the amount of damage the enemy team was dealing.  It was an extremely uptight situation and our competetive rank depended on the outcome of the match.",5,1,5,2,6,7,1,1,1,1,5,5,5,1,1,1,1,5,5,1,1,1,5,30,1,1,3,"","A17ZRK7P5TFAKK",1,2.5,1,5,1,"low",1
"2022-02-13 13:47:01","2022-02-13 14:00:10",0,"172.58.83.95",100,789,1,"2022-02-13 14:00:11","R_3j3DMv6GbDyjOka","","","","",44.9618072509766,-93.263801574707,"anonymous","EN","ABP1TJVOX62L1","Last spring/summer, my friend/neighbor helped me to dehoard my home without judgement. I hauled everything out by myself and he hauled it to the dump in his van. It was extremely generous of him to offer to help me and I could not have done it without him. At one point, he got a serious look on his face and he looked at me almost sadly and said, ""I can't believe you hauled this out all by yourself.."" and he didn't mean it in a sexist way, he meant it in a truly human way because it was massive amounts of stuff, 30+ years of accumulated junk. ",5,5,"He offered to help without me asking and he seemed glad to do it. He never made me feel bad or like I owed him something for helping me. We worked together efficiently as a really good team and we achieved a lot. ",1,4,4,4,2,6,1,2,1,1,4,4,5,1,2,1,2,4,4,1,1,1,4,43,3,1,2,"","ABP1TJVOX62L1",0,4,1.375,4,1.25,"med",1
"2022-02-13 13:53:05","2022-02-13 14:00:28",0,"68.195.142.96",100,442,1,"2022-02-13 14:00:28","R_3lEmJz1ODgqdTAP","","","","",40.9864044189453,-74.111198425293,"anonymous","EN","AOJD8D9NXVAR3","A few weeks ago, I played soccer in the back yard with my four year old grandson. We both tried our best to get the ball away from each other and into our own goals using only our feet, not our arms and hands. We both acted selfishly, losing our usual loving and generous relationship entirely, and each doing whatever was necessary to win the game.",4,4,"Each person tried to get the ball away from the other person and kick it into his/her own goal. ",5,1,3,3,5,6,1,1,1,1,4,5,5,1,1,1,2,5,5,2,2,1,5,74,2,1,6,"","AOJD8D9NXVAR3",1,2.75,1.125,4.75,1.5,"med",1
"2022-02-13 13:57:50","2022-02-13 14:00:43",0,"69.245.176.179",100,172,1,"2022-02-13 14:00:43","R_3GCVMlW2GAnaSvR","","","","",41.9459991455078,-87.7033004760742,"anonymous","EN","A1X1SOI48T1C6E","I worked on a group project at a virtual conference. We had to prepare a presentation to give to the rest of the group. ",5,2,"Work together on a project that we would all present together.",2,4,2,2,5,6,3,1,2,2,3,4,5,1,2,3,1,4,4,2,2,1,4,27,2,1,5,"","A1X1SOI48T1C6E",0,2.25,1.875,3.75,1.75,"med",1
"2022-02-13 13:57:02","2022-02-13 14:00:50",0,"99.183.214.202",100,227,1,"2022-02-13 14:00:50","R_2qfOlfTfzD5LkAJ","","","","",38.7048034667969,-90.4617004394531,"anonymous","EN","A3VYILRG5DO29C","It was a theatre audition. My group were vying for the same part. Therefore, it was in everyone’s best interest to not work together.",5,5,"Audition for a play. We read the same scenes as the others.",5,1,2,2,6,7,1,1,2,1,4,5,5,1,1,1,2,5,5,2,3,1,5,68,1,1,4,"","A3VYILRG5DO29C",1,1.75,1.25,4.75,1.75,"med",1
"2022-02-13 13:55:47","2022-02-13 14:01:03",0,"47.20.216.212",100,315,1,"2022-02-13 14:01:03","R_qPFeZQkJW8wHURj","","","","",40.8805999755859,-74.1455993652344,"anonymous","EN","AMZIAETHYXGGQ","Planning for department Open House involved cooperating with colleagues on all levels. Communication and follow-through were vital components to ensuring that various planning stages moved forward.",4,4,"We asked for feedback often, and incorporated opinions as was practicable. ",1,4,5,3,6,6,2,1,1,2,5,4,5,2,2,1,1,5,5,4,1,2,4,39,2,4,4,"","AMZIAETHYXGGQ",0,3,1.5,4.75,2.25,"med",1
"2022-02-13 13:54:55","2022-02-13 14:01:06",0,"108.214.141.83",100,371,1,"2022-02-13 14:01:07","R_1eOHJDf7JGz5S8k","","","","",25.4785003662109,-80.4843978881836,"anonymous","EN","A2JWAD9JQNA5ON","I think when me and my girlfriend worked hard to get her little sister a new PC, that's probably when I've been the most cooperative with a group of people. Though it was just me and my girlfriend putting in money and looking for the right parts and everything, it still felt like a great team effort when we finally got one that was the right fit. We looked around A LOT and talked to a lot of people so though we were doing it for her sister, it was still a great time bonding and working together for a common goal.",5,5,"Looked for the PC mostly, did all the talking the people. I had input on the PC since I have more knowledge on them but obviously neither of us are experts so we had to seek a lot of help from people, including sellers.",1,4,1,1,7,7,2,1,1,2,5,4,5,2,2,1,2,4,4,4,2,2,5,33,1,3,2,"","A2JWAD9JQNA5ON",0,1,1.625,4.25,2.25,"med",1
"2022-02-13 13:50:22","2022-02-13 14:01:22",0,"172.58.73.200",100,659,1,"2022-02-13 14:01:23","R_2Yokx5pmJK3QYKn","","","","",40.6596069335938,-111.919502258301,"anonymous","EN","A30CGO77OY7WP0","Me and a few friends went to the beach. I picked up a stone and skipped it across the water. My friends started picking up stones and the challenge started on the most skips. My friend dan skipped the most in one run. Seven stone skips across water and you never know what someone really knows.",5,1,"Had to see who could skip the most stones. A lucky stone or a swift arm to throw. I seen more stones being skipped and a few friends learning as well. My friends are dominate so they hate showing defeat.",5,1,1,1,2,6,2,1,4,1,4,5,5,1,1,2,4,5,4,2,1,1,5,34,1,1,2,"Competition is only good if two or more people are all on the same level or if one needs to pull forward to learn and exceed.","A30CGO77OY7WP0",1,2.5,2,4.5,1.25,"med",0
"2022-02-13 13:54:43","2022-02-13 14:01:48",0,"24.205.81.243",100,425,1,"2022-02-13 14:01:48","R_1QMy1mWLHThbtFb","","","","",34.1930999755859,-118.138305664062,"anonymous","EN","AU1XHCLQL2G00","I was waiting in line for a cash machine.  We had formed one line while waiting for one of three stations.  Someone saw that there was a station open and went straight there instead of getting in line.  While people yelled at him, he ignored them and went on with his business.",5,4,"Cut in line.  Didn't wait their turn.",5,1,5,4,6,6,2,1,2,1,4,5,5,2,1,2,2,5,5,2,2,2,4,68,1,1,5,"","AU1XHCLQL2G00",1,3.25,1.625,4.75,2,"med",1
"2022-02-13 13:56:41","2022-02-13 14:01:58",0,"50.90.196.42",100,316,1,"2022-02-13 14:01:58","R_2aOHajSAwJhIlgN","","","","",39.9573059082031,-86.2770004272461,"anonymous","EN","A27OXXF9NU2UZH","A group was working to celebrate Women and Girls in Science day. Our team members agreed to collect pictures of women and girls of our families and collaborate to create a video collage showing them involved with science and science exploration. ",5,5,"Each person voluntarily took a piece of that project to make the project very easy. No one was forced to participate or had to be assigned any one piece.",1,4,2,2,7,7,1,1,1,1,1,5,5,1,1,1,1,5,5,1,1,1,5,43,2,1,4,"","A27OXXF9NU2UZH",0,1.5,1,4,1,"low",1
"2022-02-13 13:52:07","2022-02-13 14:02:40",0,"174.250.242.39",100,633,1,"2022-02-13 14:02:41","R_eDO0ipUlJucv4aJ","","","","",28.6343994140625,-81.6221008300781,"anonymous","EN","A27V6J6KOHWK2P","I camphost for the Florida State parks and every winter it is crazy as we try to compete against the dam snowbirds for spots. Instead of the Flordia rez coming together and forcing the state parks to adopt a Serve a Summer to get a winter policy they rip each other apart over contracts  ",5,5,"sabotage and backstabing..... ",5,1,6,6,2,4,3,3,3,2,3,3,5,2,3,2,1,3,3,5,4,3,3,52,2,6,3,"","A27V6J6KOHWK2P",1,5.5,2.375,3,3.75,"high",1
"2022-02-13 13:58:27","2022-02-13 14:02:52",0,"66.175.155.91",100,264,1,"2022-02-13 14:02:52","R_2dlTdhqTNe9x2EA","","","","",31.5843963623047,-90.448600769043,"anonymous","EN","A2ZGAH6NOSU2PO","It was when I made a visit to the doctor's office.  We had to wait outside due to Covid and go in once called.  When I made it in there were still multiple people waiting to be checked in and they were right upon one another arguing about time of appointment and almost pushing each other to get to the receptionist.",5,5,"They were yelling and pressing forward against others.",5,1,4,5,5,6,1,1,1,1,5,5,5,1,1,1,1,5,5,1,1,1,4,58,2,2,3,"","A2ZGAH6NOSU2PO",1,3.5,1,5,1.25,"med",1
"2022-02-13 13:58:38","2022-02-13 14:03:25",0,"75.188.114.38",100,287,1,"2022-02-13 14:03:25","R_xxAvqZhf9BsBfPz","","","","",39.1390075683594,-84.4296035766602,"anonymous","EN","A35B8NF10UDORC","Earlier last year I applied for a supervisor position at work. I wasn't sure everyone who applied but I imagine there were a few others who did even though I was by far the most experienced and qualified. ",4,4,"Applied for a job on a team that I was already in. If they got the job I would report to them and likely have to train them how to perform their job.",4,1,3,4,5,5,2,2,1,3,4,4,5,2,2,2,2,4,4,3,3,2,3,47,1,1,4,"","A35B8NF10UDORC",1,3.25,2,4,2.75,"high",1
"2022-02-13 13:52:48","2022-02-13 14:03:53",0,"198.233.183.250",100,665,1,"2022-02-13 14:03:53","R_2tAxWRpt6ewSRoE","","","","",36.0021057128906,-115.147003173828,"anonymous","EN","A2Q9MC78MZ2Z2S","I was leading an integration working group where SMEs of various disciplines from different organizations within the USAF came together to engage in information sharing and solution options to solve a particular mission problem.  This is significant because recently these same organizations were in a turf war regarding who owned this mission area.   Recent developments and intel revelations were wake up calls forcing them to set aside their differences and come together in an unprecedented technical forum/summit to urgently solve the problem set.",5,4,"Sharing closely held technical information/data and acknowledging, incorporating previously scorned other ideas to ensure everything is smoothly integrated in a common system baseline for operational success.",1,4,5,5,6,6,2,2,2,3,4,4,5,3,2,2,2,4,4,3,4,3,4,47,1,5,5,"","A2Q9MC78MZ2Z2S",0,3.5,2.25,4,3,"high",1
"2022-02-13 14:01:06","2022-02-13 14:04:32",0,"68.34.249.234",100,206,1,"2022-02-13 14:04:33","R_55XIKSZVcgySMUN","","","","",43.1963043212891,-86.2716979980469,"anonymous","EN","AUPGB7M3XAFVY","My wife and son share an account on a popular game so they can rack up more points. They are cheaters trying to win the game.",4,4,"They were competing in an online game.",4,1,5,5,3,6,2,1,1,3,2,4,5,1,1,1,1,5,5,2,1,1,4,40,1,1,3,"","AUPGB7M3XAFVY",1,4.25,1.375,4,1.5,"med",1
"2022-02-13 14:01:05","2022-02-13 14:04:55",0,"107.136.145.192",100,229,1,"2022-02-13 14:04:55","R_08wZ6fuGb1kBdHr","","","","",43.0140075683594,-88.2782974243164,"anonymous","EN","A83DI5Q5K6F1F","In the last few months at work I worked to uptrain people to take over my role at work. We worked together to right a manual for the trainees and worked together to train those we have worked with or a long time.",4,4,"We worked together to create content. We worked together to edit or make suggestions within the manual. ",2,4,3,3,6,6,3,1,1,1,4,4,5,1,1,1,2,4,4,2,2,4,3,36,2,1,4,"","A83DI5Q5K6F1F",0,2.5,1.375,4,2.75,"high",1
"2022-02-13 14:01:52","2022-02-13 14:05:08",0,"65.96.191.159",100,195,1,"2022-02-13 14:05:08","R_31z00O1T6PRC4dA","","","","",41.7621002197266,-72.7266006469727,"anonymous","EN","A1RNVZBA9YT76K","We play a game for money called Liars Dice - it's all about bluffing in order to win and sometimes ganging up on a player who is doing well. It is a very selfish game but I love playing it because it involves deceptive strategies.",5,5,"We played a game for money. It requires deception and bluffing.",5,1,3,3,5,5,2,2,2,2,4,4,5,2,2,2,1,5,4,4,2,4,4,49,2,1,5,"","A1RNVZBA9YT76K",1,3,1.875,4.25,3,"high",1
"2022-02-13 13:56:30","2022-02-13 14:06:06",0,"69.4.154.8",100,576,1,"2022-02-13 14:06:07","R_01yKczGDNsJeqGZ","","","","",38.7169036865234,-121.367698669434,"anonymous","EN","AW1QY7Q83DYCJ","My employees were working on there sales quotas last December. They were hustling and bustling trying to get their bonuses in before the year end was up. Some of the employees were doing some deceptive things with their own co-workers to make their quota. It was overly competitive and almost counter productive. I had to get the team together and tell them that focusing on the success of the group would be more advantageous and profitable to everyone than trying to outperform others in the last few weeks.",4,4,"They were competing for bonuses that included individual, team, and company goals.",5,1,5,5,5,4,2,2,2,2,4,4,5,1,2,2,2,4,4,4,3,1,4,49,1,1,5,"","AW1QY7Q83DYCJ",1,4.25,1.875,4,2.5,"med",1
"2022-02-13 14:02:36","2022-02-13 14:06:39",0,"32.218.249.3",100,242,1,"2022-02-13 14:06:39","R_2f21gKWFvNVsqHd","","","","",41.3433990478516,-73.0805969238281,"anonymous","EN","A3LLAS4WXA8SKJ","a game with family",5,3,"a person I thought was not competitive pounced on my pieces",5,1,3,2,6,5,2,1,2,1,4,4,5,1,2,2,3,5,3,3,3,2,4,62,2,1,4,"","A3LLAS4WXA8SKJ",1,2.5,1.75,4,2.5,"med",1
"2022-02-13 13:59:58","2022-02-13 14:06:56",0,"107.116.13.60",100,417,1,"2022-02-13 14:06:56","R_1cV72irBzeGKAff","","","","",39.9586944580078,-82.9987030029297,"anonymous","EN","A3NK9BUXLYQ35F","Over the past year, I have worked to improve my life which has been made so much better with the help of my closest friend. She was also in a tough situation, and we worked together to help each other get out and improve our quality of life. ",5,4,"We communicated well about ehat was wrong with our situation. Once we understood, we found solutions to help each other. ",1,4,7,6,3,6,3,2,1,2,3,4,5,3,3,2,3,4,4,4,4,2,2,27,1,1,3,"","A3NK9BUXLYQ35F",0,5,2.375,3.75,3.5,"high",1
"2022-02-13 13:57:14","2022-02-13 14:08:11",0,"108.91.69.176",100,656,1,"2022-02-13 14:08:11","R_1Cg9SM9dVm9N7TV","","","","",37.9963989257812,-122.290100097656,"anonymous","EN","AWYKYM16CB00Z","I was trying to have my photographs appear in a gallery show. There were others who were younger and more ambitious than I was. I understand that I've slowed down with age, but I don't like being run over. I want my work to be chosen on merit and aesthetics, and not because I'm the loudest and brashest applicant.",5,5,"There were trying to have their work included in a gallery show. There were few spots available, and it seemed like the squeaky wheels might get the oil.",5,1,5,6,2,7,1,1,1,1,5,5,5,1,1,1,2,5,5,2,2,1,4,61,2,1,4,"","AWYKYM16CB00Z",1,4.5,1.125,5,1.75,"med",1
"2022-02-13 14:03:47","2022-02-13 14:08:36",0,"108.211.232.66",100,288,1,"2022-02-13 14:08:36","R_3M9gOGTRUpMahyD","","","","",38.2200012207031,-85.6941986083984,"anonymous","EN","A3W3FYGMP7VLKZ","The most cooperative situation I have been in the last 12 months was when I went on a community-wide search for a missing pet turtle. It seems ridiculous, but a neighbor was very psychologically attached to a turtle, which escaped during a house renovation. Given the size of a turtle and a lush, green environment, it was hard to find such a little animal - a needle in a haystack. We split into teams and searched the entire surrounding 2 miles for several days in shifts until we finally did find the turtle on my street. ",4,1,"People searched together and made a commitment to find a small animal. Each group searched for hours each day, together, and without any expectation of compensation. ",1,4,7,7,1,7,3,1,1,1,4,5,5,1,1,1,1,5,5,1,1,1,5,41,1,1,4,"","A3W3FYGMP7VLKZ",0,5.5,1.25,4.75,1,"low",0
"2022-02-13 14:02:58","2022-02-13 14:08:42",0,"76.19.177.210",100,343,1,"2022-02-13 14:08:42","R_2CrnIwJbHsQugYO","","","","",44.3923034667969,-73.2147979736328,"anonymous","EN","A3TMHPQVI7LPLO","A recent cooperative situation I was involved in was fundraising for my kids' school.  I was in charge of organizing but there were many people who helped make it such a success",5,4,"Several people took on different aspects to make the fundraiser successful. For example, one person took charge of marketing and social media to get the word out. Another person helped distribute goods and prizes, and another was a liaison with the fundraising company. ",1,4,3,2,5,7,1,1,1,2,4,5,5,1,1,1,3,5,5,4,1,1,5,40,2,1,5,"","A3TMHPQVI7LPLO",0,2.25,1.375,4.75,1.75,"med",1
"2022-02-13 14:02:36","2022-02-13 14:09:19",0,"208.107.51.116",100,403,1,"2022-02-13 14:09:20","R_2Yrl5l61eJXT21h","","","","",46.8045043945312,-100.786499023438,"anonymous","EN","A1PX5URXO5RW2Z","I've got situations at work all the time where I am in a team environment working as one.  I will have a situation this week where I will have another employee with me setting up and producing a meeting for our job.",5,5,"My employees on my team are very cooperative.  They are very open to my suggestions and vice versa.",1,4,3,4,4,7,1,1,1,1,4,5,5,1,1,1,1,5,5,1,1,1,5,35,1,1,5,"","A1PX5URXO5RW2Z",0,3,1,4.75,1,"low",1
